{
  "schema_version": "1.0",
  "signal_type": "orchestrator-decision",
  "action": "advance-phase",
  "from_phase": "build",
  "to_phase": "qa",
  "rationale": "All 17 build tasks complete, last builder-result was status=complete with tests_passed=true. Health: 0 consecutive failures, budget at 41%. Advancing to QA phase.",
  "iteration": 142,
  "timestamp": "2026-04-28T09:18:00Z"
}
